{
    "$schema": "https://raw.githubusercontent.com/HealthCatalyst/dos.install/master/deployments/schema.json",
    "kubectl": {
        "version": "1.10.0"
    },
    "azcli": {
        "version": "2.0.27"
    },
    "azure": {
        "resourceGroup": "Prod-Kub-AHMN-RG",
        "location": "westus",
        "create_windows_containers": false,
        "use_azure_networking": true,
        "acs_engine": {
            "version": "0.14.6"
        }
    },
    "service_principal": {
        "name": "",
        "delete_if_exists": false
    },
    "storage_account": {
        "delete_if_exists": false
    },
    "local_folder": "c:\\kubernetes",
    "customerid": "ahmn",
    "ssl": true,
    "allow_kubectl_from_outside_vnet": false,
    "ingress": {
        "external": "whitelist",
        "internal": "vnetonly",
        "external_ip_whitelist": "64.39.96.0/20"
    },
    "networking": {
        "vnet": "CAPVnet",
        "subnet": "AHMN",
        "subnet_resource_group": "capresourcegroup"
    },
    "network_security_group": {
        "name": "",
        "create_nsg_rules": true
    },
    "dns": {
        "name": "ahmn.healthcatalyst.net",
        "create_dns_entries": false,
        "dns_resource_group": "dns"
    }
}