{
    "$schema": "https://raw.githubusercontent.com/HealthCatalyst/dos.install/master/deployments/schema.json",
    "kubectl": {
        "version": "1.10.0"
    },
    "azcli": {
        "version": "2.0.27"
    },
    "azure": {
        "subscription": "Health Catalyst - Fabric",
        "resourceGroup": "baremetal",
        "location": "eastus",
        "create_windows_containers": false,
        "use_azure_networking": true,
        "acs_engine": {
            "version": "v0.13.0"
        }
    },
    "service_principal": {
        "name": "",
        "delete_if_exists": true
    },
    "storage_account": {
        "delete_if_exists": false
    },
    "local_folder": "c:\\kubernetes",
    "customerid": "hcut",
    "ssl": false,
    "allow_kubectl_from_outside_vnet": true,
    "ingress": {
        "external": "public",
        "internal": "public",
        "external_ip_whitelist": ""
    },
    "networking": {
        "vnet": "baremetal-vnet",
        "subnet": "default",
        "subnet_resource_group": "Imran"
    },
    "network_security_group": {
        "name": "",
        "create_nsg_rules": true
    },
    "dns": {
        "name": "baremetal.healthcatalyst.net",
        "create_dns_entries": false,
        "dns_resource_group": "dns"
    }
}